{
  "$schema": "./src/packages/kernel/schemas/project.manifest.schema.json",
  "name": "core-backend",
  "version": "1.0.0",
  "coreVersion": "1.0.0",
  "description": "Unified Backend Core Chassis & Base Platform",
  "environment": "development",
  "enabledModules": [
    "health",
    "system-ops",
    "database-ops",
    "cache-ops",
    "storage-ops",
    "messaging-ops",
    "worker-ops",
    "scheduler-ops",
    "jobs-ops",
    "logs-ops",
    "runtimes",
    "traffic",
    "performance",
    "organizations",
    "roles",
    "users",
    "auth",
    "codes",
    "settings",
    "files",
    "notifications",
    "workflows"
  ],
  "settings": {
    "defaultLocale": "vi",
    "supportedLocales": [
      "vi",
      "en"
    ]
  }
}
